{"schema_version":"0.1.0","protocol_version":"0.1.0","learner_id":"learner-local-001","updated_at":"2026-08-26T04:02:00Z","items":[{"review_id":"review-tfng-001","skill_ref":"reading.tfng.semantic-relation","due_at":"2026-08-27T04:00:00Z","reason":"delayed_retention","status":"scheduled","evidence_refs":["evt-007","evt-010"],"constraints":{"not_before":"2026-08-27T04:00:00Z","required_evidence_class":"transfer_performance"},"completion_evidence_refs":[]}]}
